[
  {
    "evidence_id": "LT03-EXACT-940-RAW-GITHUB",
    "invocation_id": "LT03-DETERMINISTIC-ARTIFACT-CONTEXT-VOLUME-01",
    "automation_id": "6ab15cd35698819195d49a1ae580a8c1",
    "source": "raw_github_start_end",
    "supersedes_observation_invocation_id": "LT03-DETERMINISTIC-ARTIFACT-CONTEXT-VOLUME-01",
    "start": {"id": 5816888104, "created_at": "2026-09-24T15:16:24Z"},
    "end": {"id": 5817157016, "created_at": "2026-09-24T15:32:04Z"}
  }
]
